<?xml version="1.0" encoding="UTF-8"?>
<tns:globalaliens xmlns:tns="http://www.example.org/AlienSchema" xmlns:xsi="http://www.w3.org/2001/XMLSchema-instance" xsi:schemaLocation="http://www.example.org/AlienSchema AlienSchema.xsd ">
  <tns:alien aid="A1">
    <tns:name>Kamil</tns:name>
    <tns:salary>10000</tns:salary>
  </tns:alien>
  <tns:alien aid="A2">
    <tns:name>Krystian</tns:name>
    <tns:salary>10000</tns:salary>
  </tns:alien>
  <tns:alien aid="A3">
    <tns:name>Kuba</tns:name>
    <tns:salary>3000</tns:salary>
  </tns:alien>
</tns:globalaliens>
